{
  "schema_version": "1",
  "id": "reference.codex-filesystem-workspace-only",
  "domain": "filesystem",
  "runtimes": ["codex"],
  "requirements": [
    {
      "control_id": "AGENT-PERM-002",
      "expectation": "pass",
      "parameters": {
        "max_additional_directories": 0,
        "max_writable_paths": 0,
        "allowed_write_patterns": []
      }
    }
  ]
}
